{
  "format": "recall.deck",
  "version": 1,
  "id": "oxford3000-b2-user-v1",
  "title": "Oxford 3000 · B2",
  "description": "668 การ์ดจากไฟล์ oxford3000.csv ที่ผู้ใช้ให้มา • คำแปลไทยและประโยคตัวอย่างตามต้นฉบับ • คำหลายระดับอยู่ทุกระดับที่ระบุ ไม่ได้ตรวจรับรองการจัดระดับหรือคำแปลโดย Oxford",
  "tags": [
    "ภาษาอังกฤษ",
    "Oxford 3000",
    "B2"
  ],
  "cards": [
    {
      "id": "oxford3000-b2-row-10",
      "front": {
        "text": "address\n(n., v.)"
      },
      "back": {
        "text": "จัดการ/กล่าวถึง\n\nตัวอย่าง: We must address this problem.\nเราต้องจัดการปัญหานี้\n\nระดับในต้นฉบับ: A1/B2 (ต้นฉบับไม่ได้แยกความหมายและชนิดคำตามระดับ)"
      }
    },
    {
      "id": "oxford3000-b2-row-48",
      "front": {
        "text": "back\n(n., adv., adj., v.)"
      },
      "back": {
        "text": "กลับ\n\nตัวอย่าง: Please come back soon.\nโปรดกลับมาเร็ว ๆ\n\nระดับในต้นฉบับ: A1/A2/B2 (ต้นฉบับไม่ได้แยกความหมายและชนิดคำตามระดับ)"
      }
    },
    {
      "id": "oxford3000-b2-row-55",
      "front": {
        "text": "bar\n(n., v.)"
      },
      "back": {
        "text": "บาร์\n\nตัวอย่าง: They met at the bar.\nพวกเขาพบกันที่บาร์\n\nระดับในต้นฉบับ: A1/B2 (ต้นฉบับไม่ได้แยกความหมายและชนิดคำตามระดับ)"
      }
    },
    {
      "id": "oxford3000-b2-row-78",
      "front": {
        "text": "bill\n(n., v.)"
      },
      "back": {
        "text": "บิล/ใบเรียกเก็บ\n\nตัวอย่าง: Please pay the bill now.\nโปรดจ่ายบิลตอนนี้\n\nระดับในต้นฉบับ: A1/B2 (ต้นฉบับไม่ได้แยกความหมายและชนิดคำตามระดับ)"
      }
    },
    {
      "id": "oxford3000-b2-row-105",
      "front": {
        "text": "but\n(conj., prep.)"
      },
      "back": {
        "text": "แต่\n\nตัวอย่าง: I tried, but I failed.\nฉันพยายามแล้วแต่ฉันทำไม่สำเร็จ\n\nระดับในต้นฉบับ: A1/B2 (ต้นฉบับไม่ได้แยกความหมายและชนิดคำตามระดับ)"
      }
    },
    {
      "id": "oxford3000-b2-row-124",
      "front": {
        "text": "chair\n(n., v.)"
      },
      "back": {
        "text": "เก้าอี้\n\nตัวอย่าง: Please take a chair.\nโปรดนั่งเก้าอี้\n\nระดับในต้นฉบับ: A1/B2 (ต้นฉบับไม่ได้แยกความหมายและชนิดคำตามระดับ)"
      }
    },
    {
      "id": "oxford3000-b2-row-126",
      "front": {
        "text": "chart\n(n., v.)"
      },
      "back": {
        "text": "แผนภูมิ\n\nตัวอย่าง: The chart shows monthly sales.\nแผนภูมิแสดงยอดขายรายเดือน\n\nระดับในต้นฉบับ: A1/B2 (ต้นฉบับไม่ได้แยกความหมายและชนิดคำตามระดับ)"
      }
    },
    {
      "id": "oxford3000-b2-row-139",
      "front": {
        "text": "close\n(v., n.)"
      },
      "back": {
        "text": "ปิด; ความใกล้ชิด\n\nตัวอย่าง: Please close the door quietly.\nโปรดปิดประตูเบา ๆ\n\nระดับในต้นฉบับ: A1/B2 (ต้นฉบับไม่ได้แยกความหมายและชนิดคำตามระดับ)"
      }
    },
    {
      "id": "oxford3000-b2-row-174",
      "front": {
        "text": "date\n(n., v.)"
      },
      "back": {
        "text": "วันที่\n\nตัวอย่าง: What date is the meeting?\nการประชุมวันที่เท่าไร\n\nระดับในต้นฉบับ: A1/B2 (ต้นฉบับไม่ได้แยกความหมายและชนิดคำตามระดับ)"
      }
    },
    {
      "id": "oxford3000-b2-row-184",
      "front": {
        "text": "detail\n(n., v.)"
      },
      "back": {
        "text": "รายละเอียด\n\nตัวอย่าง: Please check every detail carefully.\nกรุณาตรวจทุกรายละเอียดอย่างรอบคอบ\n\nระดับในต้นฉบับ: A1/B2 (ต้นฉบับไม่ได้แยกความหมายและชนิดคำตามระดับ)"
      }
    },
    {
      "id": "oxford3000-b2-row-224",
      "front": {
        "text": "even\n(adv., adj.)"
      },
      "back": {
        "text": "แม้กระทั่ง\n\nตัวอย่าง: Even Sam understood the joke.\nแม้แต่แซมก็เข้าใจเรื่องตลก\n\nระดับในต้นฉบับ: A1/B2 (ต้นฉบับไม่ได้แยกความหมายและชนิดคำตามระดับ)"
      }
    },
    {
      "id": "oxford3000-b2-row-254",
      "front": {
        "text": "feel\n(v., n.)"
      },
      "back": {
        "text": "รู้สึก\n\nตัวอย่าง: I feel tired this morning.\nฉันรู้สึกเหนื่อยเช้านี้\n\nระดับในต้นฉบับ: A1/B2 (ต้นฉบับไม่ได้แยกความหมายและชนิดคำตามระดับ)"
      }
    },
    {
      "id": "oxford3000-b2-row-282",
      "front": {
        "text": "free\n(adj., adv., v.)"
      },
      "back": {
        "text": "ฟรี\n\nตัวอย่าง: The museum is free today.\nพิพิธภัณฑ์เข้าฟรีวันนี้\n\nระดับในต้นฉบับ: A1/A2/B2 (ต้นฉบับไม่ได้แยกความหมายและชนิดคำตามระดับ)"
      }
    },
    {
      "id": "oxford3000-b2-row-388",
      "front": {
        "text": "leave\n(v., n.)"
      },
      "back": {
        "text": "ออกไป; การลา\n\nตัวอย่าง: We leave after lunch.\nเราออกไปหลังอาหารกลางวัน\n\nระดับในต้นฉบับ: A1/B2 (ต้นฉบับไม่ได้แยกความหมายและชนิดคำตามระดับ)"
      }
    },
    {
      "id": "oxford3000-b2-row-399",
      "front": {
        "text": "line\n(n., v.)"
      },
      "back": {
        "text": "เส้น; เข้าแถว\n\nตัวอย่าง: Please stand in a line.\nโปรดยืนเข้าแถว\n\nระดับในต้นฉบับ: A1/B2 (ต้นฉบับไม่ได้แยกความหมายและชนิดคำตามระดับ)"
      }
    },
    {
      "id": "oxford3000-b2-row-414",
      "front": {
        "text": "make\n(v., n.)"
      },
      "back": {
        "text": "ทำ; ยี่ห้อ\n\nตัวอย่าง: We make bread each morning.\nเราทำขนมปังทุกเช้า\n\nระดับในต้นฉบับ: A1/B2 (ต้นฉบับไม่ได้แยกความหมายและชนิดคำตามระดับ)"
      }
    },
    {
      "id": "oxford3000-b2-row-418",
      "front": {
        "text": "map\n(n., v.)"
      },
      "back": {
        "text": "แผนที่; ทำแผนที่\n\nตัวอย่าง: Mark the route on the map.\nทำเครื่องหมายเส้นทางบนแผนที่\n\nระดับในต้นฉบับ: A1/B2 (ต้นฉบับไม่ได้แยกความหมายและชนิดคำตามระดับ)"
      }
    },
    {
      "id": "oxford3000-b2-row-440",
      "front": {
        "text": "mistake\n(n., v.)"
      },
      "back": {
        "text": "ความผิดพลาด; ทำผิด\n\nตัวอย่าง: Everyone makes mistakes.\nทุกคนทำผิดพลาด\n\nระดับในต้นฉบับ: A1/B2 (ต้นฉบับไม่ได้แยกความหมายและชนิดคำตามระดับ)"
      }
    },
    {
      "id": "oxford3000-b2-row-441",
      "front": {
        "text": "model\n(n., v.)"
      },
      "back": {
        "text": "แบบจำลอง; เป็นแบบอย่าง\n\nตัวอย่าง: The model shows the bridge.\nแบบจำลองแสดงสะพาน\n\nระดับในต้นฉบับ: A1/B2 (ต้นฉบับไม่ได้แยกความหมายและชนิดคำตามระดับ)"
      }
    },
    {
      "id": "oxford3000-b2-row-487",
      "front": {
        "text": "object\n(n., v.)"
      },
      "back": {
        "text": "วัตถุ\n\nตัวอย่าง: This object is made of glass.\nวัตถุนี้ทำจากแก้ว\n\nระดับในต้นฉบับ: A1/B2 (ต้นฉบับไม่ได้แยกความหมายและชนิดคำตามระดับ)"
      }
    },
    {
      "id": "oxford3000-b2-row-540",
      "front": {
        "text": "picture\n(n., v.)"
      },
      "back": {
        "text": "รูปภาพ\n\nตัวอย่าง: Please picture a quiet beach.\nลองนึกภาพชายหาดที่เงียบสงบ\n\nระดับในต้นฉบับ: A1/B2 (ต้นฉบับไม่ได้แยกความหมายและชนิดคำตามระดับ)"
      }
    },
    {
      "id": "oxford3000-b2-row-555",
      "front": {
        "text": "positive\n(adj., n.)"
      },
      "back": {
        "text": "ที่เป็นทางบวก\n\nตัวอย่าง: Keep a positive attitude.\nรักษาทัศนคติเชิงบวก\n\nระดับในต้นฉบับ: A1/B2 (ต้นฉบับไม่ได้แยกความหมายและชนิดคำตามระดับ)"
      }
    },
    {
      "id": "oxford3000-b2-row-564",
      "front": {
        "text": "price\n(n., v.)"
      },
      "back": {
        "text": "ราคา; ตั้งราคา\n\nตัวอย่าง: They priced the jacket at fifty dollars.\nพวกเขาตั้งราคาเสื้อแจ็กเก็ตไว้ห้าสิบดอลลาร์\n\nระดับในต้นฉบับ: A1/B2 (ต้นฉบับไม่ได้แยกความหมายและชนิดคำตามระดับ)"
      }
    },
    {
      "id": "oxford3000-b2-row-569",
      "front": {
        "text": "project\n(n., v.)"
      },
      "back": {
        "text": "โครงการ; วางแผนประมาณการ\n\nตัวอย่าง: Our class started a science project.\nชั้นเรียนของเราเริ่มโครงการวิทยาศาสตร์\n\nระดับในต้นฉบับ: A1/B2 (ต้นฉบับไม่ได้แยกความหมายและชนิดคำตามระดับ)"
      }
    },
    {
      "id": "oxford3000-b2-row-599",
      "front": {
        "text": "routine\n(n., adj.)"
      },
      "back": {
        "text": "กิจวัตร; เป็นประจำ\n\nตัวอย่าง: Brushing my teeth is part of my routine.\nการแปรงฟันเป็นส่วนหนึ่งของกิจวัตรของฉัน\n\nระดับในต้นฉบับ: A1/B2 (ต้นฉบับไม่ได้แยกความหมายและชนิดคำตามระดับ)"
      }
    },
    {
      "id": "oxford3000-b2-row-617",
      "front": {
        "text": "sentence\n(n., v.)"
      },
      "back": {
        "text": "ประโยค; ตัดสินลงโทษ\n\nตัวอย่าง: Write one sentence about your weekend.\nเขียนหนึ่งประโยคเกี่ยวกับวันหยุดสุดสัปดาห์ของคุณ\n\nระดับในต้นฉบับ: A1/B2 (ต้นฉบับไม่ได้แยกความหมายและชนิดคำตามระดับ)"
      }
    },
    {
      "id": "oxford3000-b2-row-667",
      "front": {
        "text": "stand\n(v., n.)"
      },
      "back": {
        "text": "ยืน\n\nตัวอย่าง: Please stand near the entrance.\nกรุณายืนใกล้ทางเข้า\n\nระดับในต้นฉบับ: A1/B2 (ต้นฉบับไม่ได้แยกความหมายและชนิดคำตามระดับ)"
      }
    },
    {
      "id": "oxford3000-b2-row-681",
      "front": {
        "text": "subject\n(n., adj.)"
      },
      "back": {
        "text": "หัวข้อ, วิชา, อยู่ภายใต้\n\nตัวอย่าง: Science was his strongest subject at school.\nวิทยาศาสตร์เป็นวิชาที่เขาถนัดที่สุดในโรงเรียน\n\nระดับในต้นฉบับ: A1/B2 (ต้นฉบับไม่ได้แยกความหมายและชนิดคำตามระดับ)"
      }
    },
    {
      "id": "oxford3000-b2-row-728",
      "front": {
        "text": "time\n(n., v.)"
      },
      "back": {
        "text": "เวลา\n\nตัวอย่าง: What time does the shop close?\nร้านปิดกี่โมง\n\nระดับในต้นฉบับ: A1/B2 (ต้นฉบับไม่ได้แยกความหมายและชนิดคำตามระดับ)"
      }
    },
    {
      "id": "oxford3000-b2-row-730",
      "front": {
        "text": "title\n(n., v.)"
      },
      "back": {
        "text": "ชื่อ\n\nตัวอย่าง: What is the title of this book?\nหนังสือเล่มนี้ชื่ออะไร\n\nระดับในต้นฉบับ: A1/B2 (ต้นฉบับไม่ได้แยกความหมายและชนิดคำตามระดับ)"
      }
    },
    {
      "id": "oxford3000-b2-row-746",
      "front": {
        "text": "trip\n(n., v.)"
      },
      "back": {
        "text": "ทริป\n\nตัวอย่าง: Our trip to the beach was relaxing.\nทริปไปชายหาดของเราผ่อนคลายมาก\n\nระดับในต้นฉบับ: A1/B2 (ต้นฉบับไม่ได้แยกความหมายและชนิดคำตามระดับ)"
      }
    },
    {
      "id": "oxford3000-b2-row-749",
      "front": {
        "text": "try\n(v., n.)"
      },
      "back": {